<?xml version="1.0" encoding="utf-8"?>

<!DOCTYPE object
[
   <!ELEMENT object (#PCDATA|object)*>
   <!ATTLIST object name      CDATA #REQUIRED>
   <!ATTLIST object class     CDATA #REQUIRED>
   <!ATTLIST object primitive CDATA "no">
   <!ATTLIST object array     CDATA "no">   <!-- the dimensions of the array; no=0, yes=1 -->
   <!ATTLIST object null      CDATA "no">
   <!ATTLIST object version   CDATA "3.7.10">
]
>

<object class="weka.experiment.Experiment" name="__root__" version="3.7.10">
   <object array="yes" class="weka.classifiers.Classifier" name="propertyArray">
      <object class="weka.classifiers.trees.J48" name="0">
         <object class="boolean" name="debug" primitive="yes">false</object>
         <object array="yes" class="java.lang.String" name="options">
            <object class="java.lang.String" name="0">-U</object>
            <object class="java.lang.String" name="1">-M</object>
            <object class="java.lang.String" name="2">2</object>
            <object class="java.lang.String" name="3"/>
            <object class="java.lang.String" name="4"/>
            <object class="java.lang.String" name="5"/>
            <object class="java.lang.String" name="6"/>
            <object class="java.lang.String" name="7"/>
            <object class="java.lang.String" name="8"/>
            <object class="java.lang.String" name="9"/>
            <object class="java.lang.String" name="10"/>
            <object class="java.lang.String" name="11"/>
            <object class="java.lang.String" name="12"/>
            <object class="java.lang.String" name="13"/>
            <object class="java.lang.String" name="14"/>
            <object class="java.lang.String" name="15"/>
         </object>
      </object>
      <object class="weka.classifiers.trees.J48" name="1">
         <object class="boolean" name="debug" primitive="yes">false</object>
         <object array="yes" class="java.lang.String" name="options">
            <object class="java.lang.String" name="0">-C</object>
            <object class="java.lang.String" name="1">0.25</object>
            <object class="java.lang.String" name="2">-M</object>
            <object class="java.lang.String" name="3">2</object>
            <object class="java.lang.String" name="4"/>
            <object class="java.lang.String" name="5"/>
            <object class="java.lang.String" name="6"/>
            <object class="java.lang.String" name="7"/>
            <object class="java.lang.String" name="8"/>
            <object class="java.lang.String" name="9"/>
            <object class="java.lang.String" name="10"/>
            <object class="java.lang.String" name="11"/>
            <object class="java.lang.String" name="12"/>
            <object class="java.lang.String" name="13"/>
            <object class="java.lang.String" name="14"/>
            <object class="java.lang.String" name="15"/>
         </object>
      </object>
      <object class="weka.classifiers.trees.J48" name="2">
         <object class="boolean" name="debug" primitive="yes">false</object>
         <object array="yes" class="java.lang.String" name="options">
            <object class="java.lang.String" name="0">-C</object>
            <object class="java.lang.String" name="1">0.1</object>
            <object class="java.lang.String" name="2">-M</object>
            <object class="java.lang.String" name="3">2</object>
            <object class="java.lang.String" name="4"/>
            <object class="java.lang.String" name="5"/>
            <object class="java.lang.String" name="6"/>
            <object class="java.lang.String" name="7"/>
            <object class="java.lang.String" name="8"/>
            <object class="java.lang.String" name="9"/>
            <object class="java.lang.String" name="10"/>
            <object class="java.lang.String" name="11"/>
            <object class="java.lang.String" name="12"/>
            <object class="java.lang.String" name="13"/>
            <object class="java.lang.String" name="14"/>
            <object class="java.lang.String" name="15"/>
         </object>
      </object>
      <object class="weka.classifiers.trees.J48" name="3">
         <object class="boolean" name="debug" primitive="yes">false</object>
         <object array="yes" class="java.lang.String" name="options">
            <object class="java.lang.String" name="0">-C</object>
            <object class="java.lang.String" name="1">0.05</object>
            <object class="java.lang.String" name="2">-M</object>
            <object class="java.lang.String" name="3">2</object>
            <object class="java.lang.String" name="4"/>
            <object class="java.lang.String" name="5"/>
            <object class="java.lang.String" name="6"/>
            <object class="java.lang.String" name="7"/>
            <object class="java.lang.String" name="8"/>
            <object class="java.lang.String" name="9"/>
            <object class="java.lang.String" name="10"/>
            <object class="java.lang.String" name="11"/>
            <object class="java.lang.String" name="12"/>
            <object class="java.lang.String" name="13"/>
            <object class="java.lang.String" name="14"/>
            <object class="java.lang.String" name="15"/>
         </object>
      </object>
      <object class="weka.classifiers.meta.AdaBoostM1" name="4">
         <object class="boolean" name="debug" primitive="yes">false</object>
         <object array="yes" class="java.lang.String" name="options">
            <object class="java.lang.String" name="0">-P</object>
            <object class="java.lang.String" name="1">100</object>
            <object class="java.lang.String" name="2">-S</object>
            <object class="java.lang.String" name="3">1</object>
            <object class="java.lang.String" name="4">-I</object>
            <object class="java.lang.String" name="5">10</object>
            <object class="java.lang.String" name="6">-W</object>
            <object class="java.lang.String" name="7">weka.classifiers.trees.DecisionStump</object>
         </object>
      </object>
      <object class="weka.classifiers.meta.AdaBoostM1" name="5">
         <object class="boolean" name="debug" primitive="yes">false</object>
         <object array="yes" class="java.lang.String" name="options">
            <object class="java.lang.String" name="0">-P</object>
            <object class="java.lang.String" name="1">100</object>
            <object class="java.lang.String" name="2">-S</object>
            <object class="java.lang.String" name="3">1</object>
            <object class="java.lang.String" name="4">-I</object>
            <object class="java.lang.String" name="5">10</object>
            <object class="java.lang.String" name="6">-W</object>
            <object class="java.lang.String" name="7">weka.classifiers.trees.J48</object>
            <object class="java.lang.String" name="8">--</object>
            <object class="java.lang.String" name="9">-U</object>
            <object class="java.lang.String" name="10">-M</object>
            <object class="java.lang.String" name="11">2</object>
            <object class="java.lang.String" name="12"/>
            <object class="java.lang.String" name="13"/>
            <object class="java.lang.String" name="14"/>
            <object class="java.lang.String" name="15"/>
            <object class="java.lang.String" name="16"/>
            <object class="java.lang.String" name="17"/>
            <object class="java.lang.String" name="18"/>
            <object class="java.lang.String" name="19"/>
            <object class="java.lang.String" name="20"/>
            <object class="java.lang.String" name="21"/>
            <object class="java.lang.String" name="22"/>
            <object class="java.lang.String" name="23"/>
            <object class="java.lang.String" name="24"/>
         </object>
      </object>
      <object class="weka.classifiers.meta.AdaBoostM1" name="6">
         <object class="boolean" name="debug" primitive="yes">false</object>
         <object array="yes" class="java.lang.String" name="options">
            <object class="java.lang.String" name="0">-P</object>
            <object class="java.lang.String" name="1">100</object>
            <object class="java.lang.String" name="2">-S</object>
            <object class="java.lang.String" name="3">1</object>
            <object class="java.lang.String" name="4">-I</object>
            <object class="java.lang.String" name="5">10</object>
            <object class="java.lang.String" name="6">-W</object>
            <object class="java.lang.String" name="7">weka.classifiers.trees.J48</object>
            <object class="java.lang.String" name="8">--</object>
            <object class="java.lang.String" name="9">-C</object>
            <object class="java.lang.String" name="10">0.1</object>
            <object class="java.lang.String" name="11">-M</object>
            <object class="java.lang.String" name="12">2</object>
            <object class="java.lang.String" name="13"/>
            <object class="java.lang.String" name="14"/>
            <object class="java.lang.String" name="15"/>
            <object class="java.lang.String" name="16"/>
            <object class="java.lang.String" name="17"/>
            <object class="java.lang.String" name="18"/>
            <object class="java.lang.String" name="19"/>
            <object class="java.lang.String" name="20"/>
            <object class="java.lang.String" name="21"/>
            <object class="java.lang.String" name="22"/>
            <object class="java.lang.String" name="23"/>
            <object class="java.lang.String" name="24"/>
         </object>
      </object>
      <object class="weka.classifiers.meta.AdaBoostM1" name="7">
         <object class="boolean" name="debug" primitive="yes">false</object>
         <object array="yes" class="java.lang.String" name="options">
            <object class="java.lang.String" name="0">-P</object>
            <object class="java.lang.String" name="1">100</object>
            <object class="java.lang.String" name="2">-S</object>
            <object class="java.lang.String" name="3">1</object>
            <object class="java.lang.String" name="4">-I</object>
            <object class="java.lang.String" name="5">10</object>
            <object class="java.lang.String" name="6">-W</object>
            <object class="java.lang.String" name="7">weka.classifiers.trees.J48</object>
            <object class="java.lang.String" name="8">--</object>
            <object class="java.lang.String" name="9">-C</object>
            <object class="java.lang.String" name="10">0.05</object>
            <object class="java.lang.String" name="11">-M</object>
            <object class="java.lang.String" name="12">2</object>
            <object class="java.lang.String" name="13"/>
            <object class="java.lang.String" name="14"/>
            <object class="java.lang.String" name="15"/>
            <object class="java.lang.String" name="16"/>
            <object class="java.lang.String" name="17"/>
            <object class="java.lang.String" name="18"/>
            <object class="java.lang.String" name="19"/>
            <object class="java.lang.String" name="20"/>
            <object class="java.lang.String" name="21"/>
            <object class="java.lang.String" name="22"/>
            <object class="java.lang.String" name="23"/>
            <object class="java.lang.String" name="24"/>
         </object>
      </object>
   </object>
   <object class="javax.swing.DefaultListModel" name="datasets">
      <object class="java.io.File" name="0">bank.arff</object>
   </object>
   <object class="int" name="runUpper" primitive="yes">5</object>
   <object class="weka.experiment.RandomSplitResultProducer" name="resultProducer">
      <object array="yes" class="java.lang.String" name="options">
         <object class="java.lang.String" name="0">-P</object>
         <object class="java.lang.String" name="1">90.0</object>
         <object class="java.lang.String" name="2">-O</object>
         <object class="java.lang.String" name="3">splitEvalutorOut.zip</object>
         <object class="java.lang.String" name="4">-W</object>
         <object class="java.lang.String" name="5">weka.experiment.ClassifierSplitEvaluator</object>
         <object class="java.lang.String" name="6">--</object>
         <object class="java.lang.String" name="7">-W</object>
         <object class="java.lang.String" name="8">weka.classifiers.rules.ZeroR</object>
         <object class="java.lang.String" name="9">-I</object>
         <object class="java.lang.String" name="10">0</object>
         <object class="java.lang.String" name="11">-C</object>
         <object class="java.lang.String" name="12">1</object>
         <object class="java.lang.String" name="13">--</object>
         <object class="java.lang.String" name="14"/>
         <object class="java.lang.String" name="15"/>
      </object>
   </object>
   <object class="boolean" name="usePropertyIterator" primitive="yes">true</object>
   <object array="yes" class="weka.experiment.PropertyNode" name="propertyPath">
      <object array="no" class="weka.experiment.PropertyNode" name="0" primitive="no">
         <object class="weka.experiment.ClassifierSplitEvaluator" name="value">
            <object array="yes" class="java.lang.String" name="options">
               <object class="java.lang.String" name="0">-W</object>
               <object class="java.lang.String" name="1">weka.classifiers.rules.ZeroR</object>
               <object class="java.lang.String" name="2">-I</object>
               <object class="java.lang.String" name="3">0</object>
               <object class="java.lang.String" name="4">-C</object>
               <object class="java.lang.String" name="5">1</object>
               <object class="java.lang.String" name="6">--</object>
            </object>
         </object>
         <object class="java.lang.String" name="parentClass">weka.experiment.RandomSplitResultProducer</object>
         <object class="java.lang.String" name="property">splitEvaluator</object>
      </object>
      <object array="no" class="weka.experiment.PropertyNode" name="1" primitive="no">
         <object class="weka.classifiers.rules.ZeroR" name="value">
            <object class="boolean" name="debug" primitive="yes">false</object>
            <object array="yes" class="java.lang.String" name="options"/>
         </object>
         <object class="java.lang.String" name="parentClass">weka.experiment.ClassifierSplitEvaluator</object>
         <object class="java.lang.String" name="property">classifier</object>
      </object>
   </object>
   <object class="java.lang.String" name="notes"/>
   <object class="weka.experiment.CSVResultListener" name="resultListener">
      <object array="yes" class="java.lang.String" name="options">
         <object class="java.lang.String" name="0">-O</object>
         <object class="java.lang.String" name="1">bank_trees_and_boosted90.csv</object>
      </object>
      <object class="java.io.File" name="outputFile">templates/raw/bank_trees_and_boosted90.csv</object>
   </object>
   <object class="boolean" name="advanceDataSetFirst" primitive="yes">true</object>
   <object class="int" name="runLower" primitive="yes">1</object>
   <object class="java.lang.Boolean" name="classFirst">false</object>
</object>
